{
  "id": "00000000-0000-4000-8000-000000000013",
  "submission_id": "00000000-0000-4000-8000-000000000012",
  "artifact_id": "00000000-0000-4000-8000-000000000011",
  "size_bytes": 104371200,
  "part_size_bytes": 8388608,
  "part_count": 13,
  "expires_at": "2026-10-05T05:00:00Z",
  "received_parts": []
}
